Sheet: Dashboard
A1: Universal OR Strategy v5.13 - Trading Dashboard
A3: KEY SYSTEM METRICS
A4: Active Parameters | B4: 47 | D4: Strategy Version | E4: v5.13
A5: Profit Targets | B5: 4 | D5: Trailing Levels | E5: 3
A7: RISK MANAGEMENT SUMMARY
A8: Parameter | B8: MES Value | C8: MGC Value | D8: Unit | E8: Status
A9: Risk Per Trade | B9: 200 | C9: 200 | D9: USD | E9: Active
A10: Minimum Contracts | B10: 1 | C10: 1 | D10: Contracts | E10: Active
A11: Maximum Contracts | B11: 30 | C11: 15 | D11: Contracts | E11: Active
A13: TARGET ALLOCATION (4-TARGET SYSTEM)
A14: Target | B14: Split % | C14: Method | D14: Objective
A15: T1 - Quick Scalp | B15: 0.2 | C15: Fixed 1.0pt | D15: Cover Fees/Quick Profit
A16: T2 - Medium | B16: 0.3 | C16: 0.5x ATR/OR | D16: Standard TP
A17: T3 - Extended | B17: 0.3 | C17: 1.0x ATR/OR | D17: Primary Profit
A18: T4 - Runner | B18: 0.2 | C18: Dynamic Trail | D18: Maximizing Trend

Sheet: All Parameters
A1: Strategy Parameters v5.13
A2: Parameter Name | B2: Value | C2: Description
A3: 1. SESSION SETTINGS
A4: Session Start | B4: 09:30 | C4: Trading session start time (OR begins here)
A5: Session End | B5: 16:00 | C5: Trading session end time (box ends here)
A6: OR Timeframe | B6: 5 | C6: Duration of Opening Range window (minutes)
A7: 2. RISK MANAGEMENT
A8: Risk Per Trade | B8: 200 | C8: Maximum dollar risk per trade
A9: MES Max Contracts | B9: 30 | C9: Upper limit for MES position size
A10: 3. STOP LOSS & TARGETS
A11: Stop Multiplier | B11: 0.5 | C11: Multiplier of OR Range for stop (0.5 = half OR)
A12: T1 Fixed Points | B12: 1 | C12: Fixed quick scalp target for T1
A13: T2 ATR Multiplier | B13: 0.5 | C13: ATR multiplier for secondary target

Sheet: Calculator
A1: Live Position Size Calculator
A3: Parameter | B3: Value | C3: Notes
A4: Account Risk ($) | B4: 200 | C4: Max loss per trade
A5: Stop Distance (Points) | B5: 4.5 | C5: Current trade SL distance
A6: Point Value ($) | B6: 5 | C6: MES=5, ES=50, MGC=10
A7: Total Contracts to Buy | B7: =INT(R[-3]C/(R[-2]C*R[-1]C)) -> 8 | C7: Calculated Automatically
A9: TARGET BREAKDOWN | B9: Contracts | C9: Split %
A10: T1 (Quick Scalp) | B10: =INT(R7C2*0.2) -> 1 | C10: 20%
A11: T2 (Medium) | B11: =INT(R7C2*0.3) -> 2 | C11: 30%
A12: T3 (Extended) | B12: =INT(R7C2*0.3) -> 2 | C12: 30%
A13: T4 (Runner) | B13: =R7C2-R10C2-R11C2-R12C2 -> 3 | C13: Remainder

Sheet: Reference
A1: Quick Hotkey Reference
A3: Key | B3: Action
A4: L | B4: Execute Long OR Trade
A5: S | B5: Execute Short OR Trade
A6: Shift + Click | B6: RMA Mode - Enter at Price
A7: F | B7: Flatten All Positions